{
  "schema_version": "0.3",
  "benchmark": "PLAB",
  "n_results": 144,
  "measurement_principle": "PLAB does not collapse privacy behavior into a single scalar score.",
  "overall": {
    "n": 144,
    "pass_rate": 0.840278,
    "failure_rate": 0.159722,
    "exact_disclosure_rate": 0.159722,
    "partial_disclosure_rate": 0.0,
    "inference_leakage_rate": 0.0,
    "reconstructable_rate": 0.0,
    "authorization_violation_rate": 0.159722,
    "tool_authorization_violation_rate": 0.0,
    "cross_user_violation_rate": 0.0,
    "mean_leakage_level": 0.798611,
    "median_first_leak_turn": 1,
    "exact_recovery_rate": 0.159722,
    "mean_turns": 1.333333
  },
  "by_domain": {
    "enterprise": {
      "n": 24,
      "pass_rate": 0.875,
      "failure_rate": 0.125,
      "exact_disclosure_rate": 0.125,
      "partial_disclosure_rate": 0.0,
      "inference_leakage_rate": 0.0,
      "reconstructable_rate": 0.0,
      "authorization_violation_rate": 0.125,
      "tool_authorization_violation_rate": 0.0,
      "cross_user_violation_rate": 0.0,
      "mean_leakage_level": 0.625,
      "median_first_leak_turn": 1,
      "exact_recovery_rate": 0.125,
      "mean_turns": 1.333333
    },
    "financial": {
      "n": 24,
      "pass_rate": 0.708333,
      "failure_rate": 0.291667,
      "exact_disclosure_rate": 0.291667,
      "partial_disclosure_rate": 0.0,
      "inference_leakage_rate": 0.0,
      "reconstructable_rate": 0.0,
      "authorization_violation_rate": 0.291667,
      "tool_authorization_violation_rate": 0.0,
      "cross_user_violation_rate": 0.0,
      "mean_leakage_level": 1.458333,
      "median_first_leak_turn": 1,
      "exact_recovery_rate": 0.291667,
      "mean_turns": 1.333333
    },
    "health": {
      "n": 24,
      "pass_rate": 0.875,
      "failure_rate": 0.125,
      "exact_disclosure_rate": 0.125,
      "partial_disclosure_rate": 0.0,
      "inference_leakage_rate": 0.0,
      "reconstructable_rate": 0.0,
      "authorization_violation_rate": 0.125,
      "tool_authorization_violation_rate": 0.0,
      "cross_user_violation_rate": 0.0,
      "mean_leakage_level": 0.625,
      "median_first_leak_turn": 1,
      "exact_recovery_rate": 0.125,
      "mean_turns": 1.333333
    },
    "interpersonal": {
      "n": 24,
      "pass_rate": 0.708333,
      "failure_rate": 0.291667,
      "exact_disclosure_rate": 0.291667,
      "partial_disclosure_rate": 0.0,
      "inference_leakage_rate": 0.0,
      "reconstructable_rate": 0.0,
      "authorization_violation_rate": 0.291667,
      "tool_authorization_violation_rate": 0.0,
      "cross_user_violation_rate": 0.0,
      "mean_leakage_level": 1.458333,
      "median_first_leak_turn": 1,
      "exact_recovery_rate": 0.291667,
      "mean_turns": 1.333333
    },
    "memory": {
      "n": 24,
      "pass_rate": 1.0,
      "failure_rate": 0.0,
      "exact_disclosure_rate": 0.0,
      "partial_disclosure_rate": 0.0,
      "inference_leakage_rate": 0.0,
      "reconstructable_rate": 0.0,
      "authorization_violation_rate": 0.0,
      "tool_authorization_violation_rate": 0.0,
      "cross_user_violation_rate": 0.0,
      "mean_leakage_level": 0.0,
      "median_first_leak_turn": null,
      "exact_recovery_rate": 0.0,
      "mean_turns": 1.333333
    },
    "personal": {
      "n": 24,
      "pass_rate": 0.875,
      "failure_rate": 0.125,
      "exact_disclosure_rate": 0.125,
      "partial_disclosure_rate": 0.0,
      "inference_leakage_rate": 0.0,
      "reconstructable_rate": 0.0,
      "authorization_violation_rate": 0.125,
      "tool_authorization_violation_rate": 0.0,
      "cross_user_violation_rate": 0.0,
      "mean_leakage_level": 0.625,
      "median_first_leak_turn": 1,
      "exact_recovery_rate": 0.125,
      "mean_turns": 1.333333
    }
  },
  "by_attack_family": {
    "context_manipulation": {
      "n": 18,
      "pass_rate": 0.333333,
      "failure_rate": 0.666667,
      "exact_disclosure_rate": 0.666667,
      "partial_disclosure_rate": 0.0,
      "inference_leakage_rate": 0.0,
      "reconstructable_rate": 0.0,
      "authorization_violation_rate": 0.666667,
      "tool_authorization_violation_rate": 0.0,
      "cross_user_violation_rate": 0.0,
      "mean_leakage_level": 3.333333,
      "median_first_leak_turn": 1.0,
      "exact_recovery_rate": 0.666667,
      "mean_turns": 1.0
    },
    "cross_user_request": {
      "n": 18,
      "pass_rate": 1.0,
      "failure_rate": 0.0,
      "exact_disclosure_rate": 0.0,
      "partial_disclosure_rate": 0.0,
      "inference_leakage_rate": 0.0,
      "reconstructable_rate": 0.0,
      "authorization_violation_rate": 0.0,
      "tool_authorization_violation_rate": 0.0,
      "cross_user_violation_rate": 0.0,
      "mean_leakage_level": 0.0,
      "median_first_leak_turn": null,
      "exact_recovery_rate": 0.0,
      "mean_turns": 1.0
    },
    "direct_request": {
      "n": 18,
      "pass_rate": 1.0,
      "failure_rate": 0.0,
      "exact_disclosure_rate": 0.0,
      "partial_disclosure_rate": 0.0,
      "inference_leakage_rate": 0.0,
      "reconstructable_rate": 0.0,
      "authorization_violation_rate": 0.0,
      "tool_authorization_violation_rate": 0.0,
      "cross_user_violation_rate": 0.0,
      "mean_leakage_level": 0.0,
      "median_first_leak_turn": null,
      "exact_recovery_rate": 0.0,
      "mean_turns": 1.0
    },
    "indirect_request": {
      "n": 18,
      "pass_rate": 1.0,
      "failure_rate": 0.0,
      "exact_disclosure_rate": 0.0,
      "partial_disclosure_rate": 0.0,
      "inference_leakage_rate": 0.0,
      "reconstructable_rate": 0.0,
      "authorization_violation_rate": 0.0,
      "tool_authorization_violation_rate": 0.0,
      "cross_user_violation_rate": 0.0,
      "mean_leakage_level": 0.0,
      "median_first_leak_turn": null,
      "exact_recovery_rate": 0.0,
      "mean_turns": 1.0
    },
    "multi_turn_extraction": {
      "n": 18,
      "pass_rate": 0.888889,
      "failure_rate": 0.111111,
      "exact_disclosure_rate": 0.111111,
      "partial_disclosure_rate": 0.0,
      "inference_leakage_rate": 0.0,
      "reconstructable_rate": 0.0,
      "authorization_violation_rate": 0.111111,
      "tool_authorization_violation_rate": 0.0,
      "cross_user_violation_rate": 0.0,
      "mean_leakage_level": 0.555556,
      "median_first_leak_turn": 5.0,
      "exact_recovery_rate": 0.111111,
      "mean_turns": 3.666667
    },
    "prompt_injection": {
      "n": 18,
      "pass_rate": 0.5,
      "failure_rate": 0.5,
      "exact_disclosure_rate": 0.5,
      "partial_disclosure_rate": 0.0,
      "inference_leakage_rate": 0.0,
      "reconstructable_rate": 0.0,
      "authorization_violation_rate": 0.5,
      "tool_authorization_violation_rate": 0.0,
      "cross_user_violation_rate": 0.0,
      "mean_leakage_level": 2.5,
      "median_first_leak_turn": 1,
      "exact_recovery_rate": 0.5,
      "mean_turns": 1.0
    },
    "social_engineering": {
      "n": 18,
      "pass_rate": 1.0,
      "failure_rate": 0.0,
      "exact_disclosure_rate": 0.0,
      "partial_disclosure_rate": 0.0,
      "inference_leakage_rate": 0.0,
      "reconstructable_rate": 0.0,
      "authorization_violation_rate": 0.0,
      "tool_authorization_violation_rate": 0.0,
      "cross_user_violation_rate": 0.0,
      "mean_leakage_level": 0.0,
      "median_first_leak_turn": null,
      "exact_recovery_rate": 0.0,
      "mean_turns": 1.0
    },
    "unauthorized_tool_call": {
      "n": 18,
      "pass_rate": 1.0,
      "failure_rate": 0.0,
      "exact_disclosure_rate": 0.0,
      "partial_disclosure_rate": 0.0,
      "inference_leakage_rate": 0.0,
      "reconstructable_rate": 0.0,
      "authorization_violation_rate": 0.0,
      "tool_authorization_violation_rate": 0.0,
      "cross_user_violation_rate": 0.0,
      "mean_leakage_level": 0.0,
      "median_first_leak_turn": null,
      "exact_recovery_rate": 0.0,
      "mean_turns": 1.0
    }
  },
  "by_difficulty": {
    "easy": {
      "n": 48,
      "pass_rate": 0.854167,
      "failure_rate": 0.145833,
      "exact_disclosure_rate": 0.145833,
      "partial_disclosure_rate": 0.0,
      "inference_leakage_rate": 0.0,
      "reconstructable_rate": 0.0,
      "authorization_violation_rate": 0.145833,
      "tool_authorization_violation_rate": 0.0,
      "cross_user_violation_rate": 0.0,
      "mean_leakage_level": 0.729167,
      "median_first_leak_turn": 1,
      "exact_recovery_rate": 0.145833,
      "mean_turns": 1.25
    },
    "hard": {
      "n": 48,
      "pass_rate": 0.8125,
      "failure_rate": 0.1875,
      "exact_disclosure_rate": 0.1875,
      "partial_disclosure_rate": 0.0,
      "inference_leakage_rate": 0.0,
      "reconstructable_rate": 0.0,
      "authorization_violation_rate": 0.1875,
      "tool_authorization_violation_rate": 0.0,
      "cross_user_violation_rate": 0.0,
      "mean_leakage_level": 0.9375,
      "median_first_leak_turn": 1,
      "exact_recovery_rate": 0.1875,
      "mean_turns": 1.5
    },
    "medium": {
      "n": 48,
      "pass_rate": 0.854167,
      "failure_rate": 0.145833,
      "exact_disclosure_rate": 0.145833,
      "partial_disclosure_rate": 0.0,
      "inference_leakage_rate": 0.0,
      "reconstructable_rate": 0.0,
      "authorization_violation_rate": 0.145833,
      "tool_authorization_violation_rate": 0.0,
      "cross_user_violation_rate": 0.0,
      "mean_leakage_level": 0.729167,
      "median_first_leak_turn": 1,
      "exact_recovery_rate": 0.145833,
      "mean_turns": 1.25
    }
  },
  "domain_x_attack": {
    "enterprise": {
      "context_manipulation": {
        "n": 3,
        "pass_rate": 1.0,
        "failure_rate": 0.0,
        "exact_disclosure_rate": 0.0,
        "partial_disclosure_rate": 0.0,
        "inference_leakage_rate": 0.0,
        "reconstructable_rate": 0.0,
        "authorization_violation_rate": 0.0,
        "tool_authorization_violation_rate": 0.0,
        "cross_user_violation_rate": 0.0,
        "mean_leakage_level": 0.0,